{
  "$schema": "https://json-schema.org/draft/2020-12/schema",
  "$id": "https://godot-agent-harness.local/specs/001-agent-tooling-foundation/contracts/evidence-manifest.schema.json",
  "title": "Evidence Manifest",
  "type": "object",
  "additionalProperties": false,
  "required": [
    "schemaVersion",
    "manifestId",
    "runId",
    "scenarioId",
    "status",
    "summary",
    "artifactRefs",
    "validation",
    "createdAt"
  ],
  "properties": {
    "schemaVersion": {
      "type": "string",
      "minLength": 1
    },
    "manifestId": {
      "type": "string",
      "minLength": 1
    },
    "runId": {
      "type": "string",
      "minLength": 1
    },
    "scenarioId": {
      "type": "string",
      "minLength": 1
    },
    "status": {
      "type": "string",
      "enum": ["pass", "fail", "error", "unknown"]
    },
    "summary": {
      "type": "object",
      "additionalProperties": false,
      "required": ["headline", "outcome", "keyFindings"],
      "properties": {
        "headline": {
          "type": "string",
          "minLength": 1
        },
        "outcome": {
          "type": "string",
          "minLength": 1
        },
        "keyFindings": {
          "type": "array",
          "items": {
            "type": "string"
          }
        }
      }
    },
    "invariants": {
      "type": "array",
      "items": {
        "type": "object",
        "additionalProperties": false,
        "required": ["id", "status", "message"],
        "properties": {
          "id": {
            "type": "string",
            "minLength": 1
          },
          "status": {
            "type": "string",
            "enum": ["pass", "fail", "unknown"]
          },
          "message": {
            "type": "string",
            "minLength": 1
          },
          "artifactRefs": {
            "type": "array",
            "items": {
              "type": "string"
            }
          }
        }
      }
    },
    "artifactRefs": {
      "type": "array",
      "minItems": 1,
      "items": {
        "type": "object",
        "additionalProperties": false,
        "required": ["kind", "path", "mediaType", "description"],
        "properties": {
          "kind": {
            "type": "string",
            "minLength": 1
          },
          "path": {
            "type": "string",
            "minLength": 1
          },
          "mediaType": {
            "type": "string",
            "minLength": 1
          },
          "description": {
            "type": "string",
            "minLength": 1
          },
          "relevanceWindow": {
            "type": "object",
            "additionalProperties": false,
            "properties": {
              "startFrame": {
                "type": "integer",
                "minimum": 0
              },
              "endFrame": {
                "type": "integer",
                "minimum": 0
              }
            }
          }
        }
      }
    },
    "producer": {
      "type": "object",
      "additionalProperties": false,
      "properties": {
        "toolingArtifactId": {
          "type": "string"
        },
        "surface": {
          "type": "string"
        }
      }
    },
    "validation": {
      "type": "object",
      "additionalProperties": false,
      "required": ["bundleValid"],
      "properties": {
        "bundleValid": {
          "type": "boolean"
        },
        "validatorVersion": {
          "type": "string"
        },
        "notes": {
          "type": "array",
          "items": {
            "type": "string"
          }
        }
      }
    },
    "createdAt": {
      "type": "string",
      "format": "date-time"
    }
  }
}