{
  "schemaVersion": "1.0.0",
  "manifestId": "scenegraph-pong-scenegraph-missing-node-01",
  "runId": "pong-scenegraph-missing-node-01",
  "scenarioId": "pong-scenegraph-missing-node",
  "status": "fail",
  "summary": {
    "headline": "Scenegraph diagnostics found missing or misplaced nodes.",
    "outcome": "The capture succeeded, but one or more required nodes were missing or attached under the wrong branch.",
    "keyFindings": [
      "Root scene: /root/Main",
      "Snapshot nodes: 5",
      "Trigger: failure",
      "missing_node: The Ball gameplay node must exist under the Main root."
    ]
  },
  "artifactRefs": [
    {
      "kind": "scenegraph-snapshot",
      "path": "tools/tests/fixtures/pong-testbed/evidence/scenegraph-snapshot.json",
      "mediaType": "application/json",
      "description": "Latest scenegraph snapshot for the session."
    },
    {
      "kind": "scenegraph-diagnostics",
      "path": "tools/tests/fixtures/pong-testbed/evidence/scenegraph-diagnostics.json",
      "mediaType": "application/json",
      "description": "Structured missing-node and hierarchy diagnostics for the session."
    },
    {
      "kind": "scenegraph-summary",
      "path": "tools/tests/fixtures/pong-testbed/evidence/scenegraph-summary.json",
      "mediaType": "application/json",
      "description": "Agent-readable scenegraph summary entry point."
    }
  ],
  "validation": {
    "bundleValid": true,
    "validatorVersion": "1.1.0",
    "notes": [
      "Fixture paths are repository-relative.",
      "The manifest is intended to be the first file an agent reads before opening raw scenegraph artifacts."
    ]
  },
  "createdAt": "2026-04-11T00:00:00Z"
}